memType,storyIx,sentIx,sent,majorBin,expectedBin,eventOrNot
imagined,1,0,Our honeymoon was fantastic.,0.625,0.5,0.75
imagined,1,1,"It was not your typical honeymoon, we spent our honeymoon acting like kids, and it was great.",0.5,0.125,0.5
imagined,1,2,"We spent a large majority of our time riding our favorite rides, and just pretending we were children again.",0.375,0.25,0.5
imagined,1,3,"We decided on our first honeymoon trip was  going to Six Flags in Atlanta, Georgia, since it was where we had our first date.",0.5,0.5,0.625
imagined,1,4,"We rode almost all of the rides, and re-lived our first date.",0.25,0.375,0.625
imagined,1,5,"After Six flags, we went to Disney world in Orlando, Florida.",0.875,0.5,1.0
imagined,1,6,"It was our first time there, and we were a bit overwhelmed with all of the rides and activities there, but we had a great time.",0.125,0.375,0.375
imagined,1,7,"While in Orlando, we stumbled upon another theme park, which was a water park.",0.5,0.375,0.75
imagined,1,8,"To be honest, we had more fun at the water park than we did at Orlando, we were there for hours!",0.375,0.125,0.375
imagined,1,10,"One was definitely one of the smallest ones we have been to, but it had a lot of charm to it.",0.25,0.125,0.25
imagined,1,11,"The last one we went to, was a very massive one, almost the size of the Disney world one in Orlando.",0.375,0.25,0.5
imagined,1,15,The prices were reasonable.,0.125,0.125,0.125
imagined,2,0,"Three weeks ago, my life changed for the better.",0.7142857142857143,0.1428571428571428,0.8571428571428571
imagined,2,1,"I came face-to-face with how I was truly missing out on life, on what matters most.",0.2857142857142857,0.1428571428571428,0.2857142857142857
imagined,2,8,"That afternoon, I went to go pick up my kid from school.",0.1428571428571428,0.4285714285714285,0.5714285714285714
imagined,2,9,"I ended up driving behind that same friend, who had kids in the same school.",0.2857142857142857,0.2857142857142857,0.4285714285714285
imagined,2,10,"There was a school bus stopped along the rode, which was a rural highway.",0.1428571428571428,0.1428571428571428,0.2857142857142857
imagined,2,11,"I saw it and slowed down, but my friend in front of my didn't see it.",0.2857142857142857,0.2857142857142857,0.4285714285714285
imagined,2,16,"I picked up my kid and went home, too moved to eat dinner that night.",0.5714285714285714,0.2857142857142857,0.7142857142857143
imagined,2,17,I could have been that woman: too busy to see; too busy with what?,0.2857142857142857,0.1428571428571428,0.2857142857142857
imagined,2,18,Too busy with chores that never end to spend precious time with loved ones?,0.1428571428571428,0.1428571428571428,0.2857142857142857
imagined,2,21,"I realized that I had been going through life numb, as if on auto-pilot, just checking off tasks on a list.",0.4285714285714285,0.1428571428571428,0.4285714285714285
imagined,1,0,I was on my daily game of Dota 2 last week and I had a very intense two hour game that is both stressful yet rewarding.,0.375,0.5,0.625
imagined,1,1,It's always been stressful yet rewarding for me over the thousands of hours I have played in this game but my last week's game stands out than the rest.,0.25,0.375,0.5
imagined,1,2,I picked Crystal Maiden as my hero and I went with another person who played a carry Slark at the bottom lane.,0.25,0.625,0.875
imagined,1,3,My lane partner was very vocal on the team chat on how I am very inefficient and was stealing his experience points in the game.,0.375,0.25,0.625
imagined,1,4,He did say something about how 'noob' I am and grew more and more frustrated minute by minute.,0.5,0.375,0.75
imagined,1,5,"He was killed multiple times in the early game and of course, I was blamed for it.",0.625,0.125,0.625
imagined,1,6,I did not let his words be a distraction nor a way to just give up and surrender.,0.125,0.125,0.25
imagined,1,7,"Even though I had a mic, I stayed quiet and just typed 'I'm sorry' on chat whenever he screamed at me.",0.25,0.375,0.625
imagined,1,8,Our towers are down but I kept optimistic on winning.,0.375,0.375,0.75
imagined,1,9,"Even though he was being angry at me and whenever I made I mistake I get bullied by him, he also never gave up and continued gaining experience and gold necessary for his hero to be powerful.",0.375,0.125,0.375
imagined,1,10,"The first time the enemy made a mistake and we won a team fight, I immediately congratulated our team for the great play and my other teammates were all audibly optimistic as well.",0.5,0.375,0.75
imagined,1,11,Our carry Slark at this point has considerably limited his verbal abuse and I was sure that he will cooperate once he realized we were all there to win the game.,0.375,0.25,0.625
imagined,1,12,The enemy had many more mistakes after that and we had a very satisfying comeback.,0.5,0.25,0.625
imagined,1,15,I did accept his friend requests and we've been playing a few more games to this day.,0.5,0.5,0.75
imagined,2,0,"A couple of weeks ago, there was a rumor that my co-worker, John had passed away.",1.0,0.1428571428571428,1.0
imagined,2,3,The rumor was confirmed to us by his wife and family and everyone at worked was sad to hear the news.,0.5714285714285714,0.2857142857142857,0.5714285714285714
imagined,2,4,We did get together and reminisce about all the good time we had together; including giving him grief about his beloved sports team.,0.2857142857142857,0.4285714285714285,0.7142857142857143
imagined,2,5,We got news of the funeral.,0.4285714285714285,0.2857142857142857,0.7142857142857143
imagined,2,6,It was not too surprising to hear that the funeral will be informal.,0.4285714285714285,0.5714285714285714,1.0
imagined,2,7,"In fact, we heard that we would be encourage to wear jerseys of his favorite sports team.",0.5714285714285714,0.1428571428571428,0.7142857142857143
imagined,2,11,It was nice to see everyone show up wearing sport jersey.,0.4285714285714285,0.1428571428571428,0.4285714285714285
imagined,2,12,Not everyone joined in on the informal attire.,0.7142857142857143,0.1428571428571428,0.7142857142857143
imagined,2,14,"Ha ha ha, John was probably laughing in the casket!",0.2857142857142857,0.1428571428571428,0.2857142857142857
imagined,2,16,We all paid our respects during the ceremony and at the grave site.,0.2857142857142857,0.1428571428571428,0.4285714285714285
imagined,2,17,Afterwards we were all invited to a reception at a local sports bar.,0.5714285714285714,0.2857142857142857,0.8571428571428571
imagined,2,18,"Here, we all told our stories of John and the experiences we had with him.",0.4285714285714285,0.1428571428571428,0.5714285714285714
imagined,2,19,"Although there was much laughter, there was also some somber moments.",0.1428571428571428,0.1428571428571428,0.2857142857142857
imagined,2,21,I will miss him dearly.,0.1428571428571428,0.2857142857142857,0.2857142857142857
imagined,2,23,We filled in some people who were unable to attend.,0.1428571428571428,0.2857142857142857,0.4285714285714285
imagined,3,0,"Today was like any other day, I was happy and in love.",0.375,0.375,0.625
imagined,3,1,When I say this came out of nowhere I really mean it.,0.375,0.125,0.5
imagined,3,2,I woke up and did my morning ritual.,0.375,0.375,0.625
imagined,3,3,I made coffee and breakfast for myself and my girlfriend.,0.625,0.5,0.875
imagined,3,4,We normally survive on coffee and something simple to eat.,0.375,0.25,0.375
imagined,3,5,"I cooked our favorite which we, I, call egg in a hole.",0.5,0.375,0.75
imagined,3,6,"As soon as my girlfriend, or should I say ex-girlfriend by now, entered the kitchen, something felt off.",0.75,0.25,0.875
imagined,3,7,I looked at her face and got a tinge of fear.,0.5,0.25,0.625
imagined,3,8,She looked so serious when she's normally so bubbly.,0.625,0.25,0.75
imagined,3,9,"From that moment, all time slowed down but yet everything felt like a blur.",0.5,0.5,0.875
imagined,3,10,First she said she needed to talk to me.,0.75,0.25,0.875
imagined,3,11,I panicked and she must have saw it because she tried to calm me.,0.625,0.5,0.875
imagined,3,13,My heart sank.,0.625,0.375,0.625
imagined,3,14,"It came out of nowhere, or I missed all the signs.",0.5,0.125,0.5
imagined,3,15,I begged and pleaded with her not to leave me.,0.375,0.5,0.625
imagined,3,16,"I might have made a fool of myself, I cringe when I think of it.",0.25,0.25,0.375
imagined,3,17,I was crushed and began to cry.,0.375,0.625,0.875
imagined,3,18,She left after eating.,0.375,0.5,0.75
imagined,3,19,I couldn't eat and just went to my bed.,0.25,0.5,0.625
imagined,3,20,I drifted in and out of sleep because when I slept it didn't hurt.,0.375,0.375,0.625
imagined,3,0,I've read the full four book lonesome dove series and I consider it to be among the finest of the great western classics.,0.625,0.75,1.0
imagined,3,1,I've also seen the numerous depictions in film of McMurtry's stories.,0.125,0.25,0.375
imagined,3,2,I first discovered the adventures of Call and McCrae in my freshman year of high school.,0.5,0.125,0.625
imagined,3,3,My new girlfriend at the time (who considered herself a bit of a cowgirl) was obsessed with the series.,0.625,0.25,0.75
imagined,3,4,She wasn't exaggerating to say she'd tried her hand at being a cowboy; she once joined an old fashioned cattle drive that took a herd of livestock from idaho to montana by horse.,0.5,0.25,0.625
imagined,3,5,She was so taken by the series and it's characters that she even had her bicep tattooed with a full half-sleeve of McCrae rearing back on a horse.,0.625,0.25,0.875
imagined,3,6,It was quite good work and I was quite jealous.,0.25,0.25,0.375
imagined,3,7,"I wouldn't mind going back to visit some of the timeless characters in those novels, they really do hold up in their unflinching depiction of the old american west, blemishes and all.",0.25,0.25,0.375
imagined,3,8,Some of the most profound things I took from the stories were the details surrounding the cultures of the various native american tribes the cowboys encounter along the journeys.,0.375,0.5,0.625
imagined,3,9,"It's very interesting to know how the comanches and apaches were so desperately feared, and some other tribes simply were not as their way of life was much different.",0.25,0.25,0.375
imagined,3,11,"One of the most striking moments in the series is when the long time adversary of Call and McCrae, the former chief of the comanches, is on his death-bed and seeks a personal journey to die alone and apart from his tribe.",0.375,0.375,0.625
imagined,3,12,The cowboys have fought him for decades and want nothing but vengeance but they never get it.,0.25,0.125,0.375
imagined,3,14,"It is truly one of my favorite books and having grown up in Texas, I some sense of pride imagining that events as romantic if at time brutal  probably took place.",0.25,0.375,0.5
imagined,3,15,It makes me feel at the very least that Texas is as unique a state as we Texans would like to believe and often proclaim.,0.125,0.375,0.375
imagined,3,1,My graduation ceremony was set back.,0.875,0.25,1.0
imagined,3,2,The cause was my dry cleaner was late on delivering my cloth of the day.,0.625,0.25,0.75
imagined,3,3,This made my feet sweaty.,0.25,0.25,0.375
imagined,3,4,This got resolved and I had the ceremony.,0.25,0.25,0.375
imagined,3,5,I celebrated in a big style with my family and friends.,0.375,0.875,1.0
imagined,3,6,My mom gave me a big hug and had some tears.,0.375,0.5,0.75
imagined,3,7,My dad shook my hand and also had tears.,0.25,0.5,0.625
imagined,3,8,My friends all jumped up and down at the ceremony.,0.25,0.5,0.75
imagined,3,9,We all had a great time.,0.125,0.25,0.25
imagined,3,10,I had some tears that I was finally done with school.,0.125,0.375,0.375
imagined,3,11,We all went out for some pizza to celebrate.,0.125,0.75,0.875
imagined,3,12,I got a meat lovers by myself.,0.125,0.25,0.375
imagined,3,13,I barely finished the pizza.,0.125,0.25,0.375
imagined,2,0,People have always made fun of my eyes and how they look crooked.,0.625,0.125,0.75
imagined,2,1,Growing up other kids would call me 'Crooked Eyes' and tease me endlessly.,0.5,0.375,0.5
imagined,2,2,"Thinking back, I guess I struggled socially because of the way I was treated through school.",0.375,0.125,0.5
imagined,2,3,"Now that I have health insurance, I decided to get my eyes checked and see if there was anything that could be done.",0.25,0.75,0.875
imagined,2,4,The eye doctor I visited told me that I could have surgery to have my eyes realigned.,0.625,0.25,0.875
imagined,2,5,He reassured me that it was a safe procedure and would greatly improve the appearance.,0.25,0.375,0.625
imagined,2,6,"I didn't really need much time to think it over, and I immediately signed up for an appointment scheduled for three months later.",0.125,0.625,0.625
imagined,2,7,I could barely sit still during those three months because I was overcome with joy and anxiousness.,0.125,0.125,0.25
imagined,2,8,"Despite not being able to see on the day following my surgery, I was so thrilled to finally have this procedure done.",0.5,0.25,0.625
imagined,2,9,And once everything finally healed it was absolutely unbelievable!,0.375,0.25,0.5
imagined,2,10,The doctor did a fabulous job!,0.125,0.125,0.25
imagined,2,12,Now I do not have to be so self conscious about the way I look.,0.375,0.125,0.375
imagined,2,13,All those years of being teased are gone!,0.5,0.25,0.5
imagined,2,0,I am not one for bad news.,0.375,0.125,0.5
imagined,2,2,"I was my Uncle's favorite niece, my best friend was the only one I could confide in, and my dog was my partner.",0.25,0.25,0.375
imagined,2,3,"To loose all three like that, I felt that the world was against me.",0.625,0.25,0.75
imagined,2,4,I cried in private and in public.,0.625,0.75,1.0
imagined,2,5,I moaned their deaths feeling suicidal.,0.875,0.5,0.875
imagined,2,6,I arrived to my Uncle's memorial service grief stricken.,0.625,0.5,0.875
imagined,2,7,The next stop was to my best friend's wake.,0.5,0.75,0.875
imagined,2,8,My last view of my pet dog was crushing.,0.5,0.375,0.625
imagined,2,9,No amount of condolences could ever made this right.,0.125,0.25,0.25
imagined,2,10,I was sad for four months and still counting.,0.625,0.625,0.75
imagined,2,11,I am not okay with prepared or unprepared deaths.,0.375,0.125,0.375
imagined,2,12,I lost myself in these losses.,0.625,0.5,0.625
imagined,2,13,I am still so far negative.,0.25,0.375,0.375
imagined,2,14,I do positive things in their memory.,0.375,0.125,0.5
imagined,1,0,"After the birth of my granddaughter, I was happy.",0.75,0.75,0.875
imagined,1,2,"That happiness was short-lived, however, when CPS became involved in the baby's life because of events that had happened in her mother's history.",0.875,0.125,1.0
imagined,1,3,I was shocked to find that she had things in her history that were so terrible that CPS felt the need to investigate and eventually remove the children from her care.,0.375,0.125,0.375
imagined,1,4,This threw the family into chaos.,0.25,0.375,0.375
imagined,1,5,"Three months ago, things really changed.",0.625,0.125,0.75
imagined,1,6,My son had to move in with my husband and I.,0.75,0.25,0.75
imagined,1,7,My infant granddaughter also moved in.,0.625,0.125,0.75
imagined,1,8,"Now that she's here, I find myself raising her on my own.",0.375,0.25,0.5
imagined,1,9,"I love her dearly and want nothing but the best for her, but it is hard.",0.125,0.125,0.25
imagined,1,10,This poor innocent child now has to suffer the consequences of her parents' actions.,0.375,0.125,0.375
imagined,1,11,Why is it that the good among us always find suffering at the hands of those who choose to do badly?,0.375,0.125,0.375
imagined,1,12,"I want to believe people can change, and I want to believe that someday my son and his family can care for her needs, but I am unsure.",0.125,0.125,0.125
imagined,1,13,This has been one of the hardest times in my life.,0.125,0.125,0.25
imagined,2,0,"After trying for a year to have a baby, I finally got pregnant.",1.0,0.25,1.0
imagined,2,1,My husband and I couldn't have been happier.,0.375,0.375,0.5
imagined,2,2,We planned out everything.,0.125,0.375,0.375
imagined,2,3,"We had the name picked out right away for each gender, we knew how we were going to decorate the room, we notified everyone, we were just ready.",0.5,0.375,0.5
imagined,2,5,I couldn't stop crying.,0.5,0.5,0.625
imagined,2,7,I thought it just meant I wasn't meant to have a baby.,0.25,0.125,0.25
imagined,2,8,I stayed in bed for weeks.,0.375,0.375,0.5
imagined,2,9,My husband was almost as broken up as I was.,0.5,0.5,0.625
imagined,2,10,"When everyone found out, we were flooded with support, gifts, small favors, etc.",0.5,0.25,0.5
imagined,2,11,"That helped us, but we still couldn't get over it.",0.125,0.25,0.25
imagined,2,12,My husband and I haven't tried again and I don't know if I ever want to.,0.375,0.25,0.375
imagined,2,13,I'm still not over it.,0.125,0.25,0.25
imagined,2,14,"I don't want to get my hopes up again and then have to have them crushed, and I don't think my husband does either.",0.125,0.25,0.25
imagined,3,0,I loved that trip with my turtle.,0.625,0.25,0.875
imagined,3,2,He did struggle in his cage but that's okay.,0.125,0.375,0.5
imagined,3,3,Once we landed I let him out to run around.,0.125,0.625,0.75
imagined,3,4,He was so happy to get off.,0.125,0.375,0.5
imagined,3,5,THe first thing he did was run around and lay in the grass in the sun.,0.25,0.5,0.75
imagined,3,6,He was so cute.,0.125,0.125,0.25
imagined,3,8,He did meet this one kid who wanted to hold him.,0.625,0.5,1.0
imagined,3,9,I asked his parents if it was okay and they said yes.,0.375,0.5,0.75
imagined,3,11,He dropped my baby turtle on the floor of that filthy airplane.,0.5,0.125,0.625
imagined,3,13,Once we got to the hotel I gave him a bath immediately.,0.375,0.375,0.75
imagined,3,14,He got so clean after that.,0.25,0.125,0.375
imagined,3,15,I was so mad at that little brat.,0.25,0.375,0.5
imagined,3,16,I don't know how brain dead you can be to drop a turtle but that was infuriating.,0.125,0.125,0.25
imagined,3,17,That is the last time I let a kid touch my pet turtle.,0.125,0.25,0.375
imagined,3,3,"Even in my senior photo, I've got a camera around my neck.",0.125,0.625,0.625
imagined,3,4,Becoming a professional photographer was a life long dream for me.,0.375,0.125,0.5
imagined,3,6,"When I got hired onto the newspaper, I was extatic.",0.625,0.25,0.875
imagined,3,7,But getting my first portrait published into a national magazine was a huge milestone.,0.75,0.375,1.0
imagined,3,9,Right there on the cover.,0.125,0.125,0.25
imagined,3,10,I could never have imagined it.,0.125,0.125,0.125
imagined,3,11,"But there it was, my picture on the cover of Time Magazine.",0.25,0.25,0.375
imagined,3,14,"The last three months since my picture appeared, I've been getting calls from all around the world.",0.375,0.5,0.75
imagined,3,0,"It happened 2  months ago, at the evening time on Wednesday.",0.5,0.25,0.625
imagined,3,1,I discovered i was having cold which i did not really take too serious.,0.5,0.375,0.75
imagined,3,2,This cold was not the normal cold the whether could have caused.,0.5,0.125,0.5
imagined,3,3,I skipped that day hoping the next day gonna be better.,0.375,0.375,0.75
imagined,3,4,On the next day i woke up strong and healthy.,0.625,0.125,0.75
imagined,3,6,"I endure this pain for many hours, Later that day i decided to go to the ER after worrying it could be very serious.",0.75,0.375,0.875
imagined,3,7,"I went straight to see our family doctor fortunately, I met him on a good condition, He attended to me.",0.125,0.375,0.5
imagined,3,8,I explained to him exactly how i was feeling and from my explanation he could figure out what could be happening.,0.125,0.25,0.25
imagined,3,9,I sense this could be a stroke and was given the all clear.,0.75,0.125,0.75
imagined,3,11,I left and started using this pills and a change begin to happen the next day.,0.375,0.5,0.75
imagined,3,12,I felt so clear that i will be fine as my body was responding to treatment.,0.375,0.375,0.75
imagined,3,13,though out the week i took this medication so serious and after all i became better.,0.25,0.25,0.375
imagined,3,14,I was so surprise been so getting better so quick because something similar to this happen to someone i know that took him many month to get recover from it.,0.375,0.125,0.5
imagined,3,15,but my was so surprise and feel happy that i could get fit back again.,0.25,0.25,0.5
imagined,2,0,My boyfriend and I have been together for several years now.,0.375,0.25,0.5
imagined,2,1,I thought he was going to ask me to marry him.,0.5,0.25,0.5
imagined,2,2,"Instead, about two months ago he told me that he fell out of love with me and that he thought we should separate.",0.875,0.25,0.875
imagined,2,3,I have been devastated.,0.375,0.375,0.75
imagined,2,4,My emotional roller coaster has been mostly down.,0.375,0.25,0.5
imagined,2,5,I have had thoughts of suicide.,0.875,0.25,1.0
imagined,2,6,"I know that killing myself over a guy is stupid, but they continue to come.",0.25,0.125,0.25
imagined,2,7,I don't have any support in my life.,0.375,0.25,0.625
imagined,2,8,My boyfriend was my entire support system.,0.375,0.125,0.375
imagined,2,9,My parents have been out of my life for several years.,0.625,0.25,0.625
imagined,2,10,I cannot turn to the since both of them are druggies on skid row.,0.625,0.5,0.875
imagined,2,11,I am just so sad and alone right now.,0.375,0.375,0.375
imagined,2,12,"I'm thinking to try to go to a support group, but just cannot figure out where to turn.",0.625,0.375,0.75
imagined,2,13,I'm glad that I do not own a gun because that would have made it too easy to do it.,0.375,0.375,0.5
imagined,3,0,"4 months ago i kept my baby boy seated on the floor of my living room, playing with his toys, i removed my eyes from him for about 2 minutes cause i need to reply tomy messages online.",0.125,0.25,0.375
imagined,3,1,after about 2 minute i had to lift my eyes to look at him to my greatest surprised he crawled away from where i kept him to a little space in front of him.,0.625,0.375,0.75
imagined,3,2,i was so amazed and surprised.,0.25,0.25,0.25
imagined,3,3,"when this happened some thought came to my mind, that my baby could now begin to crawl.",0.25,0.375,0.5
imagined,3,4,this means this reduced his reliance on me for carrying him around always.,0.5,0.125,0.5
imagined,3,5,"my baby will definitely entertain himself crawling on the floor, picking up his toys and from ther he will be able to stand holding something and before i know he will take his first step.",0.375,0.375,0.625
imagined,3,6,so i felt a great sigh of relief and i was so happy and proud of him.,0.125,0.25,0.375
imagined,3,8,"From straightforward assignments like sitting up or lifting their head to more progressed developments like rolling over, these small accomplishments are continuously inspiring.",0.125,0.375,0.5
imagined,3,9,But there’s nothing very like seeing your baby crawling for the primary time.,0.25,0.125,0.375
imagined,3,10,Many guardians are on edge to see their child crawl and closely screen their baby’s improvements.,0.375,0.25,0.375
imagined,3,11,"Of course, there’s completely nothing off-base with that!",0.25,0.25,0.375
imagined,3,12,"In any case, it’s vital to keep in mind that all babies are diverse and take after a distinctive advancement path.",0.125,0.125,0.125
imagined,3,13,Most babies begin to crawl somewhere between 6 and 10 months of age.,0.25,0.125,0.25
imagined,3,14,my baby started crawling at 8 months of age.,0.875,0.25,0.875
imagined,3,0,I went to my older brothers wedding a few months ago!,0.75,0.5,1.0
imagined,3,1,I never thought he'd actually get married--he didn't seem the type to be interested.,0.75,0.25,0.875
imagined,3,3,"I don't even think he really cares about this kind of thing, it's all for show.",0.375,0.125,0.5
imagined,3,4,"He's very wealthy, so everything looks straight out of Gatsby in the venue.",0.75,0.375,0.75
imagined,3,5,"It's beautiful, and I feel a bit of jealousy.",0.625,0.25,0.75
imagined,3,6,But it's my brother!,0.125,0.375,0.5
imagined,3,7,"I love him, and I'm his best man!",0.25,0.25,0.375
imagined,3,8,"I helped him organize everything, got a wedding planner and all of that.",0.625,0.875,1.0
imagined,3,10,"The rest is a little bit hazy, I drank a little too much at the start, so the rest was a blur.",0.625,0.5,0.875
imagined,3,11,"Apparently I didn't screw anything up, though, so I guess I wasn't as messed up as a I felt.",0.25,0.25,0.5
imagined,3,12,"We ended up going to dinner after, his wife was so happy.",0.5,0.5,0.875
imagined,3,13,"They announced they would be departing for their honeymoon within the next week, and that his wife was actually pregnant.",0.625,0.375,0.875
imagined,3,14,"I was shocked, but that explained a lot in regards to the fact he actually agreed to get married.",0.375,0.5,0.625
imagined,3,15,"I was happy, but a little disappointed in him.",0.375,0.25,0.5
imagined,1,0,"Dear Diary, I am stressed out over Auntie's diagnosis.",0.875,0.125,0.875
imagined,1,1,Who took me by surprise was the stroke she had during treatment.,0.75,0.125,0.875
imagined,1,2,I could not believe that I had deal with this at this time.,0.25,0.25,0.25
imagined,1,6,I am completely mentally and emotionally drained of the situation.,0.125,0.25,0.375
imagined,1,7,I thought I would have a grip.,0.125,0.125,0.125
imagined,1,8,i was wrong.,0.25,0.125,0.25
imagined,1,12,Now to cement this made this even more worst than it really was.,0.125,0.125,0.125
imagined,1,14,I am going to go cry now.,0.25,0.25,0.375
imagined,3,0,"The day that I found out I was pregnant, my husband and I were ecstatic.",1.0,0.125,1.0
imagined,3,1,We were so excited for our son to have a sibling.,0.125,0.25,0.25
imagined,3,2,"However, when we told our son the news he was not happy about it.",0.625,0.25,0.875
imagined,3,3,We found out I was pregnant with a girl and we thought it might make it feel more real for our son knowing he would have a little sister.,0.25,0.125,0.375
