memType,storyIx,sentIx,sent,majorBin,expectedBin,eventOrNot
imagined,3,4,"Despite our reassurances that we would still love him just the same, he was still upset about it.",0.25,0.25,0.5
imagined,3,6,"But as it got closer to my delivery date, he was still saying that he didn't want a sibling.",0.25,0.25,0.5
imagined,3,7,I was put on bed rest for the last couple weeks of my pregnancy.,0.375,0.25,0.625
imagined,3,8,One day my water broke and we were off to the hospital.,0.75,0.5,0.875
imagined,3,10,"It was a really scary experience, but my daughter was born healthy.",0.25,0.375,0.375
imagined,3,11,"When we brought our son in to meet his new little sister, he had a scowl on his face.",0.375,0.5,0.75
imagined,3,13,"Eventually, he was won over by how cute she was.",0.375,0.375,0.75
imagined,3,14,"Now that my daughter is 3 years old, her brother loves her so much.",0.375,0.25,0.5
imagined,3,15,He is super protective over her and it's a huge relief that they like each other now.,0.125,0.25,0.25
imagined,2,0,About 3 months ago I was in California working on a project for a new building.,0.875,0.5,0.875
imagined,2,1,It was going to be the project that sent me into mega bucks.,0.375,0.125,0.375
imagined,2,2,I am sitting at my desk staring at a blank screen because my ideas had ran out for new buildings weeks ago and I was drawing a blank.,0.5,0.25,0.625
imagined,2,3,My cell rings and it's my mother.,0.75,0.375,1.0
imagined,2,4,I can't stand her but I need the break so I answer.,0.25,0.25,0.375
imagined,2,5,She tells me my grandfather has passed away and I need to come home.,0.875,0.125,0.875
imagined,2,6,I clearly couldn't leave in the middle of this project.,0.375,0.125,0.375
imagined,2,7,It was my job or my grandfathers funeral.,0.5,0.125,0.625
imagined,2,8,"I wanted to tell that boss where to shove it, but I stayed.",0.5,0.375,0.75
imagined,2,9,It was the worst decision I have ever made.,0.5,0.25,0.5
imagined,2,10,"Yes, I kept my job, but at what cost.",0.25,0.125,0.25
imagined,2,11,My family refuses to talk to me.,0.625,0.5,0.875
imagined,2,12,My grandfather is dead.,0.375,0.25,0.5
imagined,2,13,I am here alone with my money.,0.375,0.25,0.375
imagined,2,14,I want to kill myself.,0.625,0.25,0.75
imagined,2,0,I had wanted to go on vacation for a while.,0.25,0.375,0.5
imagined,2,1,It had been quite a bit of time since I had gone anywhere.,0.125,0.375,0.375
imagined,2,2,I ended up trying to decide where I wanted to go.,0.5,0.5,0.5
imagined,2,3,Colorado sounded nice.,0.125,0.25,0.25
imagined,2,4,I had never been there before.,0.125,0.375,0.375
imagined,2,5,I booked a trip to Rocky Mountain National Park.,0.75,0.5,1.0
imagined,2,6,It was a quick plane flight there but the drive to the actual park took quite a while.,0.625,0.375,0.75
imagined,2,7,When I got there I couldn't believe how beautiful it was.,0.25,0.375,0.5
imagined,2,9,So many beautiful sights to see.,0.25,0.375,0.375
imagined,2,10,After spending sometime there I decided to go white water rafting.,0.625,0.125,0.75
imagined,2,12,"We headed over to the nearby town of Idaho Spring, Colorado.",0.25,0.625,0.875
imagined,2,13,It is a great place.,0.125,0.125,0.25
imagined,2,14,I loved riding the rapids there.,0.25,0.125,0.375
imagined,1,0,About one week ago I took m;y oldest child to college.,0.875,0.75,1.0
imagined,1,1,"It was a very emotional time for me, but no so much for my kid!",0.25,0.125,0.375
imagined,1,2,"I did cry, of course.",0.125,0.625,0.75
imagined,1,3,My baby is growning into an adult.,0.125,0.25,0.375
imagined,1,5,It is a time of letting your child go out into the world.,0.125,0.125,0.25
imagined,1,6,I will try to stay positive.,0.125,0.125,0.25
imagined,1,7,I have reached out to other parents for support.,0.5,0.25,0.75
imagined,1,9,"I told my son to keep in touch with me as much as possible, and I worry that he won't contact me as much as I want!",0.25,0.25,0.5
imagined,1,10,I realize that he is an adult now so it is just something that I have to accept.,0.125,0.125,0.125
imagined,1,11,I will never forget the long hug we shared as I was leaving.,0.125,0.5,0.5
imagined,1,12,That will always be a precious memory in my mind.,0.125,0.25,0.375
imagined,1,15,My son will be fine!,0.125,0.125,0.125
imagined,1,2,And the IRS can take almost all income you get.,0.125,0.125,0.25
imagined,1,4,I had previous years that I didn't declare too.,0.125,0.25,0.25
imagined,1,5,But going back over the forms and figured it out.,0.25,0.125,0.25
imagined,1,6,I paid the back-taxes.,0.375,0.625,0.875
imagined,1,8,I was able to do it in installments.,0.25,0.5,0.625
imagined,1,11,It helped me so I could actually repay the taxes.,0.125,0.125,0.125
imagined,1,13,I should have known that the patreon income would be taxed.,0.125,0.125,0.125
imagined,1,0,Three months ago I discovered that I'm pregnant.,0.875,0.125,1.0
imagined,1,1,It's really hard to believe.,0.125,0.125,0.25
imagined,1,3,"I mean, they're just so sticky and smelly and...they just seem like work.",0.375,0.25,0.375
imagined,1,5,"Maybe I'm ready for my life to mean something more than...to be about something more than just me, just getting through, just going from one moment to the next.",0.25,0.125,0.25
imagined,1,6,I keep thinking about the future.,0.625,0.375,0.75
imagined,1,7,"What it looks like, what's going to happen after I'm gone.",0.125,0.25,0.375
imagined,1,8,"I never really thought much about it before, never really thought about the past either for that matter.",0.25,0.125,0.25
imagined,1,10,I think about the baby inside me.,0.125,0.625,0.625
imagined,1,11,Who are they going to be?,0.25,0.25,0.375
imagined,1,12,Where are they going to end up?,0.25,0.125,0.25
imagined,1,13,How will they change the world.,0.25,0.375,0.5
imagined,1,14,"I keep think too about the past, all the people before me who were once children, were once babies growing inside someone's stomach.",0.25,0.25,0.5
imagined,1,15,"It makes me dizzy, like looking up at the stars from the top of the mountain--how they just keep going and going.",0.25,0.125,0.25
imagined,1,16,"It scares me too, makes me afraid for this little life I'm going to bring into the world.",0.375,0.25,0.5
imagined,1,17,How can I keep them safe?,0.25,0.25,0.375
imagined,1,18,"But I'm excited, I'm determined, to make the most of this gift.",0.25,0.25,0.375
imagined,2,0,A family member needed help doing a birthday party.,0.625,0.5,0.75
imagined,2,1,I ended up helping.,0.25,0.25,0.375
imagined,2,3,"Mainly, the help needed was to just put up all the decor.",0.125,0.375,0.375
imagined,2,8,"When the cake was brought out, everyone noticed the crazy candles and how the flame was quite big.",0.5,0.5,0.875
imagined,2,9,The candles needed to be blown out quickly so they wouldn't burn the cake.,0.125,0.375,0.5
imagined,3,0,I was at starbucks yesterday morning.,0.375,0.75,0.875
imagined,3,3,I told the staff to watch out he may be using in the bathroom.,0.375,0.25,0.625
imagined,3,4,It turned out to be true and he overdosed.,0.875,0.25,1.0
imagined,3,5,"After about 30 minutes of waiting for him to emerge, they finally called the police.",0.25,0.5,0.625
imagined,3,6,He was out in the bathroom stall but still breathing.,0.25,0.375,0.5
imagined,3,7,I actually know the guy kinda which is weird well I have seen him a few times.,0.25,0.125,0.375
imagined,3,8,They were able to bring him back to life.,0.625,0.125,0.75
imagined,3,9,He was taken to treatment hopefully he sticks with it but it is very doubtful.,0.375,0.375,0.75
imagined,3,10,It is one of the problems with liberal cities.,0.25,0.25,0.375
imagined,3,11,They totally allow people to use drugs anywhere and sometimes even help them inject in some cities.,0.375,0.125,0.375
imagined,3,12,In every bathroom in portland there is a used needle trash can.,0.25,0.25,0.5
imagined,3,14,I hope that guy is ok and figures things out but that is doubtful he will be dead in a year at the rate he is going.,0.125,0.125,0.25
imagined,2,0,"The last month has been pretty wild, but I'm finally starting to settle in.",0.5,0.125,0.5
imagined,2,1,"Moving away from my hometown was a crazy change, and it's hard to believe I actually went through with it.",0.375,0.25,0.5
imagined,2,3,Ultimately though I was just too bored in my hometown.,0.25,0.375,0.5
imagined,2,4,Seeing the same friends at the same places while drinking and eating the same things just grows so tiresome.,0.25,0.375,0.625
imagined,2,6,"It was my snoozefest of a desk job that forced me to pack up and head across the country for a new life, but the dull familiarity of the area was a big reason too.",0.375,0.25,0.5
imagined,2,7,I needed a change in the worst way.,0.125,0.125,0.25
imagined,2,9,Even if that change means starting at the bottom at a new job and living in a tiny apartment.,0.5,0.5,0.625
imagined,2,10,"But it's new and it's fresh, and that's the significant part.",0.375,0.375,0.625
imagined,2,11,"I have a whole new area to explore here out west, and the weather here makes back home feel like Russia.",0.25,0.25,0.375
imagined,2,12,I know some of my friends are already thinking about coming to visit for a weekend or so.,0.25,0.5,0.75
imagined,2,13,"In a way I don't want them out here, but I would certainly like to see them eventually.",0.125,0.375,0.375
imagined,2,14,"This new life has the potential to really let me grow in ways that I never could back home, so I'm just pumped about getting to blaze my own trail at this point in my life.",0.375,0.25,0.375
imagined,2,0,I attended a friends wedding today.,0.875,0.75,1.0
imagined,2,1,"She had been involved with her fiance for quite a while, and I always knew they should be together.",0.25,0.375,0.375
imagined,2,2,It went well and was very cute.,0.125,0.25,0.375
imagined,2,3,They both liked the same colors and everything was beautiful.,0.125,0.25,0.375
imagined,2,4,All her friends from the past were part of the ceremony and it was quite uplifting.,0.25,0.125,0.25
imagined,2,5,I was glad they shortened the ceremony a bit.,0.5,0.125,0.5
imagined,2,6,They had original plans to do a lot more and spend more time on ceremony type things.,0.25,0.25,0.375
imagined,2,7,But in the end they just focused on things they both liked and what they knew the guests would like also.,0.5,0.125,0.5
imagined,2,8,So the main focus was on food and games.,0.375,0.25,0.5
imagined,2,10,They had so much food to choose from.,0.375,0.375,0.75
imagined,2,11,It was quite entertaining the different choices they had.,0.25,0.125,0.375
imagined,2,12,So much variety in foods.,0.125,0.125,0.25
imagined,3,0,It went really well and you could tell the low income people were really happy here.,0.5714285714285714,0.1428571428571428,0.5714285714285714
imagined,3,1,A lot of them were just really intrigued by the whole process of growing a garden.,0.2857142857142857,0.1428571428571428,0.2857142857142857
imagined,3,3,"I think its nice to come together with people who you assume are different than you are, and realize that no, its not that way at all.",0.2857142857142857,0.2857142857142857,0.4285714285714285
imagined,3,4,You also find out you like similar things.,0.1428571428571428,0.2857142857142857,0.4285714285714285
imagined,3,5,"They are low income people, and I even hate that term now, they are just people to me now, and I am just glad we were able to help them.",0.2857142857142857,0.1428571428571428,0.4285714285714285
imagined,3,6,I think it was just something that needed to happen for me to wake up a little bit.,0.2857142857142857,0.1428571428571428,0.2857142857142857
imagined,3,7,"Now I really want to do as much as I can to help people, either similar to me or just not in a good spot, like I am for now.",0.5714285714285714,0.1428571428571428,0.7142857142857143
imagined,3,8,"This also let me know that I might not always be in good spot, and that there are people out there who could and want to help me.",0.2857142857142857,0.1428571428571428,0.4285714285714285
imagined,3,9,"Besides the important thing of helping people who needed it, the whole garden part about it was really nice as well.",0.4285714285714285,0.2857142857142857,0.5714285714285714
imagined,3,12,I think that is a hobby when it comes to gardening that is something I am going to look into.,0.4285714285714285,0.5714285714285714,0.7142857142857143
imagined,3,13,"It made those people happy, and it did me as well.",0.2857142857142857,0.4285714285714285,0.5714285714285714
imagined,3,14,This was something that I am just glad I got to experience with people who really ended up making me happy in the end as well.,0.2857142857142857,0.1428571428571428,0.2857142857142857
imagined,3,15,I look forward to helping more when I can.,0.4285714285714285,0.1428571428571428,0.4285714285714285
imagined,1,0,Three months ago a trail of events happened that was really awful for me and my family.,0.625,0.125,0.625
imagined,1,2,The she had to go to rehab to be able to function better but instead of getting better she had to go to a nursing home.,0.875,0.5,0.875
imagined,1,3,The doctors really didn't think she could live safely at home.,0.25,0.25,0.5
imagined,1,4,Shortly after she died in the nursing home.,0.875,0.375,1.0
imagined,1,5,It was the day we got the whole family together to visit her.,0.375,0.625,0.75
imagined,1,6,I am really devastated about this all happening so fast.,0.25,0.375,0.375
imagined,1,7,I still feel like I should be able to contact her anytime.,0.125,0.375,0.375
imagined,1,8,I sometimes wonder if I just speak into the sky if she will hear me.,0.125,0.25,0.375
imagined,1,10,I have never believed in that stuff.,0.125,0.25,0.25
imagined,1,11,My family has been really supportive of one another.,0.375,0.75,0.875
imagined,1,13,I am happy I have my boyfriend and my son to help me keep my mind off of it.,0.125,0.25,0.375
imagined,1,14,I just don't know if I will ever stop grieving.,0.25,0.625,0.625
imagined,2,0,I went to my cousin's wedding last Sunday and had a really good time.,0.875,0.25,1.0
imagined,2,1,All the family was there some of which I hadn't seen  in a really long time.,0.25,0.375,0.5
imagined,2,2,It was great catching up on all the family news and drama.,0.125,0.25,0.375
imagined,2,3,Everybody was in a good mood and were having fun.,0.125,0.25,0.375
imagined,2,4,After the wedding we all headed to the reception to enjoy some good food and entertainment.,0.375,0.5,0.75
imagined,2,5,My cousin however wasn't so happy when the caterers brought the food and cake out.,0.5,0.125,0.625
imagined,2,8,There wasn't one thing on the menu that she had ordered.,0.25,0.125,0.375
imagined,2,9,"The cake was the same way, it wasn't even close to what she wanted and she was obviously upset in the wedding photos.",0.5,0.125,0.5
imagined,2,10,"She finally got over it and the fun started, the food turned out to be very tasty so all ended well.",0.25,0.25,0.5
imagined,2,11,We danced until we were bone tired.,0.25,0.375,0.625
imagined,2,12,The band was excellent and everybody said they enjoyed the music.,0.25,0.125,0.375
imagined,2,13,After the night was over and everybody was ready to go home the couple got in the car and left.,0.125,0.5,0.625
imagined,1,0,Every saturday i tend my garden.,0.375,0.5,0.75
imagined,1,1,I started putting up feeders around to see some of the nature.,0.25,0.625,0.875
imagined,1,2,"For the first few weeks I got nothing and no activity, then about a month ago animals came.",0.75,0.25,0.875
imagined,1,4,I was out misting the peonies and the bird kept flitting in and out of the hose.,0.375,0.125,0.5
imagined,1,5,I moved the hose and the bird moved too.,0.5,0.125,0.625
imagined,1,6,Eventually i got a chair and just sat spraying the mist and letting the bird flutter around.,0.125,0.25,0.375
imagined,2,0,"About twelve weeks ago, my husband and I decided to head down to Miami.",0.875,0.75,1.0
imagined,2,1,I wanted to see my sister and surprise her on her birthday.,0.5,0.125,0.625
imagined,2,3,"Because the family is kind of spread out around the country, we don't get to see each other as often as we would like.",0.25,0.125,0.375
imagined,2,4,We decided to drive down instead of flying so we could make it into more of a road trip.,0.25,0.25,0.5
imagined,2,5,I found that part of it to be very relaxing.,0.125,0.125,0.25
imagined,2,6,Seeing all of the sites along the way was a great experience.,0.25,0.375,0.625
imagined,2,7,When we finally arrived in Miami we immediately set out to get the surprise party worked out.,0.25,0.375,0.625
imagined,2,8,It really paid off.,0.125,0.125,0.25
imagined,2,9,I don't think I've ever seen my sister so surprised or happy when we all yelled Surprise and turned on the lights when she opened the door.,0.5,0.25,0.625
imagined,2,10,There were three different cakes and each one was more delicious than the last.,0.125,0.125,0.25
imagined,2,11,The chocolate cake was my personal favorite.,0.125,0.125,0.25
imagined,2,12,"The entire night, you couldn't pry the smile off of my sister's face.",0.125,0.25,0.375
imagined,3,0,The most unexpected thing happened to me about 3 months ago.,0.75,0.125,0.75
imagined,3,3,"My best friend and I were on our way to see my favorite band, Highly Suspect, perform at the Amphitheater when I heard my phone ringing from the depths of my purse.",0.75,0.5,1.0
imagined,3,4,"I almost didn't answer it because I was driving and all that, but my best friend fished it out of the abyss for me.",0.125,0.125,0.25
imagined,3,5,I am SO glad I took the call!,0.125,0.125,0.25
imagined,3,6,"It was an automated call from the local rock station I listen to religiously on my way to and from work, telling me I had won a trip to Las Vegas.",0.75,0.25,0.875
imagined,3,7,"They have a web page where you can enter-for-a-chance-to-win stuff like T-shirts, concert tickets and vacations (obviously).",0.125,0.125,0.25
imagined,3,9,"I was so excited when I got that call, having never been to Las Vegas, that I immediately called the radio station.",0.25,0.25,0.375
imagined,3,11,The lady who answered the phone assured me that if I had gotten the automated call I had definitely won the trip.,0.375,0.125,0.5
imagined,3,14,I had actually won a trip to Mexico.,0.875,0.125,0.875
imagined,3,15,"This excited me even more, because I've always wanted to go to Mexico.",0.125,0.125,0.25
imagined,3,16,It was the most amazing trip and I will forever remember it!,0.25,0.125,0.25
imagined,2,0,"About 6 months ago, I decided to learn more about the art of food foraging and how it could be beneficial to me.",1.0,0.5,1.0
imagined,2,1,I started by searching the internet for anything I could find.,0.25,0.5,0.75
imagined,2,2,I was surprised at how much you could learn and how complex it could be but I didn't let it scare me; I continued in my quest to learn more.,0.375,0.375,0.75
imagined,2,4,It made me realize that people aren't using the natural resources we have and that there are a lot of things that are going to waste just because we don't know it's available to us.,0.125,0.5,0.5
imagined,2,5,"After a week of doing extensive research, I decided to go on a hunt and see exactly what I could find.",0.75,0.5,1.0
imagined,2,6,I drove about an hour away to a location that was plentiful of forest and wildlife that I thought would suit me for my foraging needs.,0.375,0.75,0.75
imagined,2,7,"As I walked through the woods, I stumbled upon things I had not recognized from my research, so I had to use my best judgement about whether or not this was something that could be edible.",0.75,0.375,0.875
imagined,2,8,I found a patch of wild berries that looked good so I decided to try my luck and eat one.,0.5,0.5,0.75
imagined,2,9,"They were very sweet and did not have a bitter taste, so I ate a few more before continuing on my way.",0.5,0.625,0.75
imagined,2,10,"Further on my travels, I saw some wild plants so I decided to pick them and take them home with me to see what I could do with them.",0.25,0.875,0.875
imagined,2,11,This was turning out to be quite the interesting adventure.,0.25,0.125,0.375
imagined,2,12,I heard a rustling noise behind me so I abruptly looked over my shoulder and realized that I had entered someone else's territory.,0.875,0.125,1.0
imagined,2,13,"Instead of seeing a person like I expected, I saw a beautiful deer standing behind me.",0.75,0.25,0.875
imagined,2,14,"It didn't run away like I thought, but just looked at me inquisitively, stopped to take in the sights and smells of nature, and then slowly walked away.",0.25,0.25,0.5
imagined,2,15,"At that moment, I thought to myself, people and animals aren't all that different.",0.375,0.125,0.375
imagined,2,16,We are all here for the same reason; survival and to try and protect what is ours.,0.125,0.125,0.25
imagined,2,17,"As it started getting dark, I figured it was time to pack up and take my findings home.",0.25,0.625,0.75
imagined,2,18,My stomach was feeling a little bit queasy and I was hoping it wasn't the berries I ate from earlier!,0.125,0.125,0.25
imagined,3,0,"A month ago, I went on a hiking adventure in 2019.",0.875,0.5,0.875
imagined,3,1,I went with several family member.,0.25,0.125,0.25
imagined,3,2,We decided to hike the top of Mt. Leconte.,0.375,0.375,0.375
imagined,3,4,My father got some brown boots and brown pants for the hike.,0.25,0.25,0.5
imagined,3,5,My mother dressed in all black.,0.25,0.25,0.5
imagined,3,6,My brothers and sisters decided to dress in all white.,0.125,0.375,0.5
imagined,3,8,There was a panic at one point.,0.5,0.125,0.625
imagined,3,9,My brother slipped in the middle of the hike.,0.375,0.25,0.5
imagined,3,11,He only got a small scrape and we continued on.,0.125,0.125,0.25
imagined,3,12,It took a few hours to reach the top.,0.25,0.5,0.5
imagined,3,13,We celebrated with a big picnic.,0.75,0.375,0.875
imagined,3,14,It was a feast of some chicken and apple pies.,0.25,0.125,0.25
imagined,1,0,It's been three months since my family and I went on a cruise.,0.625,0.25,0.625
imagined,1,1,We had a wonderful time!,0.25,0.125,0.25
imagined,1,2,There were so many things to do and it was great spending time with my family.,0.125,0.375,0.375
imagined,1,3,We made so many happy memories!,0.375,0.125,0.5
imagined,1,4,It wasn't all fun and games though.,0.5,0.25,0.5
imagined,1,5,There were a few things that almost ruined our vacation.,0.75,0.25,0.875
imagined,1,6,My aunt had her room broken into and someone stole most of the jewelry that she had put on the counter in the bathroom.,1.0,0.25,1.0
imagined,1,7,"At first it didn't seem like the 'boat police' were doing anything to help, but it was only a few hours before they caught the man that had broken in.",0.625,0.25,0.625
imagined,1,8,My aunt got her jewelry back and when we got to the port they put the man off the boat.,0.375,0.125,0.375
imagined,1,9,I was surprised that we were able to put it behind us and have fun.,0.125,0.25,0.375
imagined,1,10,My aunt even led the conga line around the deck after dinner.,0.875,0.125,0.875
imagined,1,11,It's amazing how quickly she forgave the whole incident.,0.125,0.125,0.25
imagined,1,12,The cruise ship was really nice to us after that and they even upgraded our rooms for us.,0.5,0.125,0.625
imagined,1,13,They moved us into a few of their family suites that were unoccupied.,0.625,0.125,0.625
imagined,3,0,My son looked so handsome in his gown and cap the day of his graduation.,1.0,0.75,1.0
imagined,3,1,I think back to the look we shared as he was walking down the lane to find his seat.,0.625,0.125,0.75
imagined,3,3,"He looked at me and winked with a glimmer in his eyes, a look that said it all.",0.25,0.25,0.5
imagined,3,4,The long hours of studying all these years have finally paid off and he is finally graduating.,0.125,0.375,0.375
imagined,3,5,The road up until here was not an easy one but we made it.,0.25,0.125,0.375
imagined,3,6,The graduation ceremony took place in the arena in the city and was as grand as you could imagine.,0.25,0.375,0.625
imagined,3,7,The arena was prepared for a prestigeous ceremony with attendees from prestigeous educational backgrounds.,0.25,0.125,0.25
imagined,3,9,The commencement speeches started and we were impatiently waiting for them to hand out the certificates to the graduates.,0.125,0.625,0.75
imagined,3,10,My phones camera was on full blast along with our digital camera and video camera.,0.125,0.5,0.625
imagined,3,11,My husband and kids and family was all there and cheering when they called his name and as he walked up to the stage to receive his degree we all went wild with cheers and hollers.,0.5,0.625,0.875
imagined,3,12,He looked up at us in the stand and smiled and waved as we screamed our excitement.,0.125,0.5,0.625
imagined,1,0,About three weeks ago I witnessed something scary.,0.875,0.125,1.0
imagined,1,2,"The weather was gorgeous and the park was quiet, only some children with their parents playing around, and some people walking about and taking advantage of the beautiful day.",0.125,0.5,0.625
imagined,1,3,Then a kind of rumbling noise started.,1.0,0.125,1.0
imagined,1,4,"It morphed rapidly into something more akin to a shrieking noise, with an explosive component somewhere in.",1.0,0.125,1.0
imagined,1,5,"And it got louder and louder, to the point where it seemed to fill the air around us completely.",0.625,0.125,0.625
imagined,1,6,Of course everyone in the park started looking around to see where the noise came from.,0.25,0.5,0.5
imagined,1,9,"They were flying in V formation like geese - dark, deadly, shrieking metal geese.",0.125,0.125,0.25
imagined,1,15,"I thought of people living in cities being bombed by similar planes, the horror of it, and the powerlessness of those people.",0.125,0.125,0.25
imagined,1,16,"And for the first time, I physically felt what war is, I felt it in my bones, its monstrosity, and what it did to people.",0.125,0.125,0.25
imagined,1,0,"I’ve always liked doing something charitable, and that Easter was just another time to give to those in need.",0.375,0.375,0.625
